{
  "schema": "hb/cohort/1",
  "suite": {
    "id": "py-maint",
    "version": "1.0.0",
    "digest": "sha256:1a1f48f807e8a32f88249911159c37056e027431e16ab4c1bbc6aa4b994a5e93"
  },
  "model": {
    "provider": "nebius-token-factory",
    "base_url": "https://api.tokenfactory.nebius.com/v1/",
    "model_id": "Qwen/Qwen3-30B-A3B-Instruct-2507",
    "wire": "openai-chat-completions"
  },
  "runtime": {
    "runner": "github-hosted/ubuntu-24.04/x64",
    "harness_cpus_milli": 2000,
    "harness_memory_mib": 8192,
    "harness_pids": 512,
    "network": "gateway-only"
  },
  "budget": {
    "wall_seconds": 1200,
    "total_tokens": 2000000,
    "model_calls": 200
  },
  "track": "stock",
  "reps": 3
}
